{
  "$schema": "http://json-schema.org/draft-07/schema#",
  "type": "array",
  "items": {
    "type": "object",
    "properties": {
      "url": {
        "type": "string",
        "format": "uri"
      },
      "location": {
        "type": "string"
      },
      "maintainer": {
        "type": "string"
      },
      "maintainerUrl": {
        "type": "string",
        "format": "uri"
      },
      "online": {
        "type": "boolean"
      },
      "lastChecked": {
        "type": "string",
        "format": "date-time"
      }
    },
    "required": ["url", "location", "maintainer", "maintainerUrl", "online", "lastChecked"]
  }
}
